{
  "schemaVersion": "skill.v0.1",
  "name": "kb-just-coding",
  "description": "带项目上下文写代码：读知识库(目录规范/命名/踩坑) + repo-map(现有符号)，给 AI 一份带「这个项目」背景的写码 prompt。比静态模板强在：不是通用写法，是符合本项目约定的写法。",
  "trigger": ["帮我写代码", "写一个", "实现一个", "just coding", "kb写码", "新增功能"],
  "phase": "P4",
  "knowledge": {
    "requires": ["代码目录的分层规则", "文档和文件的命名规则"],
    "optional": ["历史踩坑记录", "测试方法、验收标准", "前端技术栈选型", "后端技术栈选型"]
  },
  "input": {
    "args": [
      {
        "name": "task",
        "description": "要写什么（自然语言描述）",
        "required": true,
        "example": "写一个解析 yaml frontmatter 的 Python 函数"
      },
      {
        "name": "--file",
        "description": "目标输出文件路径（可选）",
        "required": false,
        "example": "scripts/parse-frontmatter.py"
      },
      {
        "name": "--context",
        "description": "参考文件路径，AI 会读取该文件的符号上下文（可选）",
        "required": false,
        "example": "scripts/check-ai-project.sh"
      }
    ]
  },
  "output": {
    "stdout": "给 AI 的写码 prompt：含项目写码规范 + 目录结构 + 符号上下文，AI 输出代码 + 放哪个文件 + 简短说明，修改现有文件时等用户确认"
  },
  "sideEffects": [
    { "type": "none", "description": "只读分析备料；代码写入由 AI 在用户确认后执行" }
  ],
  "action": {
    "type": "shell",
    "command": "bash scripts/kb-just-coding.sh \"${args.0}\" --file \"${args.1}\" --context \"${args.2}\""
  }
}
