{
  "schemaVersion": "skill.v0.1",
  "name": "kb-workflow",
  "description": "研发流程编排器：把多个专家技能串成完整工作流。四种模式：ask(知识问答) / debug(排障) / review(代码评审) / full(完整流程)。P4 核心技能。",
  "trigger": ["开始流程", "完整流程", "workflow", "帮我排查", "帮我评审", "全流程", "kb流程"],
  "phase": "P4",
  "knowledge": {
    "requires": ["项目当前所处阶段"],
    "optional": ["历史踩坑记录", "测试方法、验收标准", "代码目录的分层规则"]
  },
  "input": {
    "args": [
      {
        "name": "mode",
        "description": "工作流模式：ask / debug / review / full",
        "required": true,
        "example": "debug"
      },
      {
        "name": "input",
        "description": "任务描述或文件路径",
        "required": true,
        "example": "启动时报 API_KEY 缺失"
      }
    ]
  },
  "output": {
    "stdout": "各步骤专家技能的聚合输出 + 综合指令，AI 基于完整上下文给出统一方案"
  },
  "sideEffects": [
    { "type": "none", "description": "编排器本身只读；具体修改动作由 AI 在用户确认后执行" }
  ],
  "action": {
    "type": "shell",
    "command": "bash scripts/kb-workflow.sh ${args.0} \"${args.1}\""
  }
}
