{
  "schemaVersion": "skill.v0.1",
  "name": "kb-generate-docs",
  "description": "文档生成：带项目上下文生成标准工程文档（AGENTS/README/HANDOFF/PROJECT/LESSONS/CHANGELOG）。先读文档规范知识库，再基于目标项目的 Git 历史和目录结构生成符合规范的文档草稿，确认后写入。",
  "trigger": ["帮我写文档", "生成文档", "写 AGENTS", "写 README", "写 HANDOFF", "generate docs", "kb文档"],
  "phase": "P4",
  "knowledge": {
    "requires": ["文档的编写边界、格式规范、更新规则和校验约束"],
    "optional": ["文档 frontmatter 元数据的字段定义", "文档和文件的命名规则"]
  },
  "input": {
    "args": [
      {
        "name": "doc_type",
        "description": "文档类型：agents / readme / handoff / project / lessons / changelog",
        "required": true,
        "example": "agents"
      },
      {
        "name": "target",
        "description": "目标项目路径（默认当前目录）",
        "required": false,
        "example": "/Users/me/my-project"
      }
    ]
  },
  "output": {
    "stdout": "给 AI 的文档生成 prompt：含文档规范 + 项目现有情况 + Git 背景 + 具体生成要求，AI 输出草稿后等用户确认再写入"
  },
  "sideEffects": [
    { "type": "none", "description": "只读分析；文档写入由 AI 在用户确认后执行" }
  ],
  "action": {
    "type": "shell",
    "command": "bash scripts/kb-generate-docs.sh ${args.0} ${args.1}"
  }
}
