{
  "schemaVersion": "skill.v0.1",
  "name": "kb-test-fix",
  "description": "测试修复专家：站在测试规范/架构知识层之上，分析测试失败原因并给出修复方案或补测试草稿。",
  "trigger": ["测试失败", "修复测试", "test fix", "kb测试", "帮我看看测试"],
  "phase": "P2",
  "knowledge": {
    "requires": ["测试方法、验收标准"],
    "optional": ["代码目录的分层规则", "历史踩坑记录"]
  },
  "input": {
    "args": [
      {
        "name": "test_output_file",
        "description": "测试失败输出文件路径（可选，不传则自动运行 check-testing.sh 或读 stdin）",
        "required": false,
        "example": ".project-os/reports/test-output.txt"
      }
    ]
  },
  "output": {
    "stdout": "给 AI 的修复 prompt：含测试规范 + 失败信息，AI 判断根因并给出修复代码/标注不适用/补测试草稿"
  },
  "sideEffects": [
    { "type": "none", "description": "只读分析；代码修改由 AI 在用户确认后执行" }
  ],
  "action": {
    "type": "shell",
    "command": "bash scripts/kb-test-fix.sh ${args.0}"
  }
}
