{
  "schemaVersion": "skill.v0.1",
  "name": "kb-tech-review",
  "description": "技术评审专家：站在架构/规范/命名/前后端知识层之上做代码评审，给出分级问题清单和合并建议。",
  "trigger": ["代码评审", "tech review", "看看这段代码", "评审一下", "kb评审"],
  "phase": "P2",
  "knowledge": {
    "requires": ["代码目录的分层规则", "AI 在本项目中的行为边界"],
    "optional": ["前端技术栈选型", "后端技术栈选型", "设计 token 体系", "文档和文件的命名规则", "历史踩坑记录"]
  },
  "input": {
    "args": [
      {
        "name": "file_or_dir",
        "description": "要评审的文件或目录路径（不传则用 git diff HEAD）",
        "required": false,
        "example": "scripts/check-ai-project.sh"
      }
    ]
  },
  "output": {
    "stdout": "给 AI 的评审 prompt：含相关知识规范 + git diff，AI 输出分级问题(🔴必须改/🟡建议改/🟢可以更好)+ 合并建议"
  },
  "sideEffects": [
    { "type": "none", "description": "只读操作，不写文件" }
  ],
  "action": {
    "type": "shell",
    "command": "bash scripts/kb-tech-review.sh ${args.0}"
  }
}
